{
  "elements_url": "https://raw.githubusercontent.com/MISP/misp-galaxy/master/elements/",
  "default_predicate_value_in": "values",
  "default_predicate_value": "value",
  "cluster_url": "https://raw.githubusercontent.com/MISP/misp-galaxy/master/cluster/threat-actor.json",
  "predicate_in": "elementOneOf"
}
